Question,Answer
Booking Your Flight,"BOOKING YOUR FLIGHT
Know any details regarding your flight bookings."
Where can I get all the information about Buddha Air?,You can find all the information about Buddha Air on our website at www.buddhaair.com
How can I purchase my ticket online?,You can purchase your flight ticket from our website at www.buddhaair.com or from our official mobile app.
Can I purchase Buddha Air flight ticket from overseas?,"Yes, you can safely and conveniently book tickets from our website at www.buddhaair.com and mobile app. We accept Visa, MasterCard, American Express, UnionPay for payment methods."
Can I purchase child ticket online?,"Yes, you purchase a child ticket online on our website at www.buddhaair.com. Child fare is applicable for the passenger(s) aged between 02 Years to (under) 12 Years of age. 33% of the normal fare is discounted for this type of passenger(s). 
A child over 12 years of age at the time of booking will be considered an adult."
Can I purchase infant ticket online?,"No, infant ticket cannot be purchased online. You will need to purchase infant ticket during check-in at the airport. Please note that infant fare is applicable for passenger(s) aged 7 days from birth to (under) 02 years. 
Only 10 % of the normal fare will be charged for Infant passenger(s)."
Do you have discount for child fare?,"Yes, we have discount for child fare. 33% of normal fare is discounted for child passenger."
Do you have discount for infant fare?,"Yes, we have discount for infant fare. Only 10% of normal fare will be charged for infant passenger."
What is the age category for child passenger?,"Passenger(s) who are above 2 years and under 12 years at the time of travel are considered child passenger(s).  
If the child is above 12 years of age, he/she is considered a young passenger."
What is the age category for infant passenger?,Passenger(s) who are 7 days old to under 2 years old at the time of travel are considered infant passenger(s).
Do you provide unaccompanied minor service?,"Yes, we provide Unaccompanied Minor Service for children aged between 5 to 12 years old. For more information, please link here https://www.buddhaair.com/detail/um-below-12-years"
Can I book a flight even if I'm not one of the passengers?,"Yes, you can purchase tickets even if you're not the passenger. We have different section divided on our website for cardholder name and passenger name."
What is the maximum number of tickets I can purchase online?,You can purchase maximum of eight tickets (adults and children) from websites or mobile apps.
What is the time duration for booking ticket online?,You will need to complete all the required procedures within 15 minutes from the time you have selected your flight.
What should I do if the hunting line/reservation line is busy?,"If our hunting line/reservation number 01-5970900 is busy, please contact our respective sales offices or outstations. https://www.buddhaair.com/detail/contact-us"
Where do I check information about my flight ticket?,You can check information about your flight ticket on our website's Ticket Status or call 01 5970900.
What currency is the fare quoted in?,The fare is quoted in Nepali Rupees (NPR) for Nepali and Indian passengers while USD for foreign nationals.
Why is there a difference in online airfare from the one I had booked/purchased earlier?,"Air fares and ticket prices vary as per market requirements. Furthermore, changes in fuel cost and government policies can also lead to differences in air fares. Your ticket will display a breakdown of all the costs you have paid."
"How do I know if the ticket I have purchased/booked includes taxes, surcharges and fees?",The ticket will clearly display a breakdown of all the costs you have paid.
"If I have purchased a ticket online, where is the proof that my ticket is confirmed?",An email of the ticket will be sent to the email address provided while booking the ticket.
I have incorrectly entered the wrong passenger name? What do I do?,"Please send the corrected name(s) with all the flight details (PNR, BT Code, Ticket Number and Sector) to u4tickets@buddhaair.com"
What should I do if I did not receive my e-ticket in my mail?,Please call 01 5970900 or email u4tickets@buddhaair.com or contact your point of issue.
"I have purchased a ticket, but need to reschedule. What do I do?","You can reschedule your ticket, but charges and terms & conditions are applied. To reschedule, you can email at u4tickets@buddhaair.com or contact + 977 1 5454084 or 5421015 (Ext 141, 142, 177,178)."
Can I cancel my ticket?,"Yes, you can. But cancellation charges apply. Please have a look at the terms and conditions www.buddhaair.com/detail/flight-fare-rules-and-regulations"
Can I cancel my booking?,Booking will automatically be cancelled if you do not purchase it within the duration of the TTL (Time to Leave). No charges will be added for cancelled booking.
Where do I pay infant fare?,You will need to pay the infant fare at the airport at the time of check-in.
Where do I pay child fare?,Child fare will need to be paid when you are purchasing your tickets. You have to select the passenger as child at the time of booking.
My session has timed out? What to do?,"Refresh the site, and go through the whole booking process. Please note that at the time of booking, you are prompted to complete your flight ticket booking process within 15 minutes. If you do not do so within the allotted time, then you session will time out."
Can I check the dates and fares available without booking?,"Yes, you can. You need to fill in the information for your desired date, destination, no, of passengers and nationalities, and the available flight times and fares will be shown on the website."
I did not received my e-ticket. What do I do?,Please email u4tickets@buddhaair.com with your booking details.
Does Buddha Air have any loyalty program?,"Yes, we have our very own loyalty program called Royal Club for our frequent flyers. People can easily become a member by filling in a form, that is available for free. For more information, please visit www.buddhaair.com/company/royal-club-1"
"I've tried searching for the ticket on your website many times, and it still says ""no flights available."" Why?","Please try clearing your cache and try to search again. If the desired tickets are not found, the flight dates you have searched for may have been fully booked or ticketed."
Can I choose my seat?,"At the moment, we do not offer seat assignment option for our passengers. However, you can write a note that you will like to be seated near the aisle or window when booking your ticket on the remark section."
I've accidentally misspelled my name when booking? What do I do?,"Unfortunately, we do not have name change facility online at the moment. If you need to change the error in your name, please email u4tickets@buddhaair.com. If the name change is not possible, you will need to cancel and book your ticket again. Cancellation charges will apply.www.buddhaair.com/detail/flight-fare-rules-and-regulations"
Can I book a ticket for more than one destination?,"Yes, you can issue a ticket for more than one destination. However, after you have purchased ticket for one destination, you will need to go through the whole selection and payment process again for the other destination."
Will extra fees and charges need to be paid besides the fare displayed online?,"No, all the fares and taxes that need to be collected are clearly shown at the time of booking. This includes PSC (Airport Tax) and Fuel Charges along with fare."
What is online booking? How do I use it? What are its benefits?,"Online booking is an easy and convenient way for you to search and issue your flight ticket using our website or mobile app. You can use it by visiting our website at www.buddhaair.com or downloading our mobile app [ Google Play Store: https://bit.ly/1QJhgFq  /  App Store: https://apple.co/2R23cJT ]. Through online booking, you can easily search and check for available tickets on your requested date."
Can I just check for fares and not purchase a ticket?,"Yes, you can use our website or mobile app just to check for fares on the requested dates. A payment will only be made when you have completed the booking process."
Can I book my ticket online and pay for the ticket later on?,This service is not available on our website and mobile app.
Can I use more than one card for payment online?,"No, you can only use one card at the time of purchasing your tickets."
Can I book a seat of my choice?,"At the moment, we do not have seat choice facility. But, if you would like to request for a window or aisle seat, at the time of booking. On the website, you can write it under remarks. If you're booking on the phone, kindly request our representative that you would like a seat of your choice."
How do I get a printed ticket?,"If you've purchased your ticket from our website or mobile app, an e-ticket should be sent to you on your email OR If you have logged in as a customer, your tickets will be available on the ""My Booking"" tab on both our website and mobile app. If you did not receive your email, you can easily get the ticket on our website here http://r1.buddhaair.com/manageBooking/ . You need to fill in your PNR and ticket number."
There's a middle name field while booking the tickets online. What if I don't have a middle name?,"You can leave the middle name field blank when booking your ticket. Please ensure that your first name and last name are spelt correctly, according to the valid photo ID card you will be showing at the airport during check-in."
"Can I purchase the flight ticket if I am the cardholder, but passenger is someone else?","Yes, if you are the cardholder, you can buy the ticket on behalf of the other person. You will need to fill in your details in the cardholder section. There's a dedicated section for passenger details, which you will need to fill with the name and contact number of the passenger."
"I've been getting the ""no flights available"" page while searching for flights. Why?","Flights for the desired dates may not be available. Please try searching the flights for another day. If the problem still persists, try clearing your browser cache and search for the flights again."
Can another person purchase a ticket for me on my behalf?,"Yes, if you are the passenger, a trusted person can purchase the ticket for you as we have dedicated sections for cardholder details and passenger details."
How do I book a ticket for my child?,A child passenger is between the age of above 2 years and below 12 years of age at the time of flying (booking). There is a 33% discount on normal fare for child fare. Tickets for child passenger can easily be booked from our website.
How can I book ticket for my baby?,Passengers below 2 years of age are considered infant. There is no online booking available for infant/baby. Ticket will have to be purchased from the airport at the time of booking. Only 10% of fare needs to be paid for infant passenger.
Does the passenger name have to be as to appears on the valid photo ID?,"Yes, it is mandatory that the passenger name is written correctly as it appears on the valid photo ID since airports have strict requirements for security."
What time is shown on the ticket?,The time shown in the ticket is in Nepali time (GMT+5:45).
I have an international flight connection. How much time gap should I keep to book my domestic flight?,"We would advise you to book your domestic tickets a day in advance before your international flight. If this is not possible, it is best to book your domestic flight 6 to 7 hours prior to your international flight departure.
Due to Nepal's unpredictable weather and traffic congestion at Tribhuvan International Airport, Kathmandu, scheduled domestic flights might get delayed.
Regarding compensation for delay, we don’t have any policy on that. Please read the terms and conditions carefully before purchasing flight tickets."
What document is required for child passengers to travel?,A child passenger will require a birth certificate or other Valid ID (School ID) to travel.
What is the lifespan of Buddha Air's ticket?,"As per the ticket cancellation policy, all generated tickets of Buddha Air holds 1 year of lifespan, therefore, should be used or request refund within a year. Buddha Air does provide a refund on the cancellation of your tickets, but cancellation charges apply accordingly."
Baggage,"BAGGAGE
Get information about baggage."
How much of free check baggage is allowed in your flight?,"Checked baggage allowance differs according to fare class:
Y class 25 kg 
A class 20 kg
B class 20 kg
D class 15 kg
C class 15 kg
E class 15 kg"
What is the cabin baggage / carry on baggage limit on Buddha Air Flights?,A passenger is allowed one cabin baggage and one personal bag/laptop bag.
Do Royal Club members get extra baggage allowance?,"Yes, Royal Club members get extra baggage allowance of up to 5 kg."
What are the charges for excess baggage?,Extra baggage charges differ according to destinations. Check out the latest charges for extra baggage here www.buddhaair.com/detail/baggage
How much do I pay for excess baggage?,Extra baggage charges differ according to destinations. Check out the latest charges for extra baggage here www.buddhaair.com/detail/baggage
Am I allowed to carry excess baggage?,"Yes, you are allowed to carry excess baggage, but excess baggage charges apply."
What is the size of the cabin luggage/carry on/hand carry luggage?,The maximum size of the cabin hand baggage cannot exceed 55 cm x 40 cm x 20 cm (20 x 14 x 9ins).
What is the maximum dimensions and weight restrictions for my cabin baggage?,The maximum size of the cabin hand baggage cannot exceed 55 cm x 40 cm x 20 cm (20 x 14 x 9ins).
Where do I pay for excess baggage?,You will pay for excess baggage at the airport during check-in.
How many bags can I carry in the aircraft?,You can carry up to two pieces of hand carry or cabin baggage in the aircraft.This includes a personal bag and a cabin bag.
What are the restricted items that I cannot bring?,"Articles such as the following shall not be carried by passengers in their baggage or elsewhere without the consent of and prior arrangement with Carrier.
Compressed gases (flammable, non-flammable and poisonous)
Corrosives (such as acids, wet batteries)
Explosives, munitions, firework and articles which are easily ignited
Flammable liquids and solid (such as flammable aerosols, lighter or heating fuels, matches)
Oxidising materials: Poisons: Radioactive materials:
Other restricted articles (such as mercury, magnetic material, offensive or irritating materials)."
What do I do if my baggage is missing or misplaced?,"If your cabin baggage/hand carry or checked-in baggage has been lost, misplaced or damaged, immediately inform a Buddha Air representative at the airport. You will need to fill in a Property Irregularity Report (PIR) before you leave the airport premises. While filling in the form, please correctly indicate your flight details, baggage tag number, details of what your baggage looks like and your contact details."
Do I need to pay for checked luggage?,"BAGGAGE Get information about baggage. DO I NEED TO PAY FOR CHECKED LUGGAGE? No, you do not need to pay for checked luggage, if the checked luggage does not exceed the weight allowance."
What do I do if my checked luggage/baggage is damaged?,"The first step is to immediately inform our employee before you leave the airport premises. Our employee will give you a form to fill in, stating the damage and losses incurred. We will look into the matter immediately and get back to you."
What is checked baggage?,Checked baggage is the baggage that you will check-in at the airport. The baggage will be safely and securely stored in the aircraft.
What is cabin baggage?,Cabin baggage is the hand carry or carry on bag that you bring with you onboard the aircraft.
What items are prohibited and restricted on board Buddha Air flights?,"Articles such as the following shall not be carried by passengers in their baggage or elsewhere without the consent of and prior arrangement with Carrier.
Compressed gases (flammable, non-flammable and poisonous)
Corrosives (such as acids, wet batteries)
Explosives, munitions, firework and articles which are easily ignited
Flammable liquids and solid (such as flammable aerosols, lighter or heating fuels, matches)
Oxidising materials: Poisons: Radioactive materials:
Other restricted articles (such as mercury, magnetic material, offensive or irritating materials)."
Where can I find the policy and terms and conditions for baggage?,"For policy and terms and conditions, please visit www.buddhaair.com/detail/baggage"
Does Buddha Air carry human remains?,"No, we do not carry human remains."
Can I carry alcohol in my cabin baggage?,"Yes, you can carry alcohol, but it must be sealed pack and must observe the weight and dimension limitation of the cabin baggage."
Can I travel with my pet on the flight?,"Yes, you can travel with your pet. For more information on this, please click here www.buddhaair.com/detail/traveling-with-pets"
What are the maximum dimensions and weight restrictions for my cabin baggage?,The dimension of the cabin hand baggage cannot exceed 55 cm x 40 cm x 20 cm (20 x 14 x 9ins). The weight allowance is 5 kg.
Do children / child passengers have the same baggage allowance as adults?,"Yes, they have the same baggage allowance as adults."
What items are not allowed in my hand carry/ cabin baggage?,"You cannot carry the following items in your cabin baggage or hand carry:
Lighters and matches
Toy or replica guns
Loose batteries
Aerosol sprays
Sharp items like knives, scissors, nail cutter, razor blades, needles, paper cutter, etc.
Any dangerous items like corrosives, radioactive materials, ammunition, firearms, etc."
Can I bring hypodermic needles or medical needles in the hand carry / cabin baggage.,"Yes, we understand that some of our passengers require hypodermic needles for their medical condition. Therefore, you are allowed to carry the hypodermic needle in your hand carry. Please ensure that you are able to provide medical evidence or doctor's prescription that you need the needles."
Where do I place my hand carry or cabin baggage in the aircraft?,"For our Beechcraft aircraft, your hand carry / cabin baggage must be securely stowed underneath the airline seat.
For our ATR aircraft, your hand baggage or cabin baggage must be stowed in the overhead cabin bins."
Does the weight limit on hand carry / cabin baggage differ according to fare class?,"No, it does not. Whatever fare you have purchased your ticket in, the weight of the hand carry or cabin baggage is limited to 5 kg per person."
What is delayed baggage?,"Sometimes, due to aircraft weight restrictions, your checked in baggage may not fly with you. Therefore, we will put your checked in baggage in the nearest flight possible. We will inform you of delayed baggage."
"My delayed baggage has still not arrived, What do I do?",Please call the respective airport or airport in-charge immediately if your baggage has not arrived. We will take the necessary steps to locate your baggage and deliver it to you.
How can I report missing or damaged baggage?,"It is important that you report your missing or damaged baggage before you leave the airport to our employee. You will need to file a report regarding the same, with accurate and complete description of your baggage including its contents. Once the report is filed, we will take measures to located it."
What happens when you've found my missing baggage?,"As soon as we find your missing baggage, we will contact you in the given number. You will have to visit our airport to receive your baggage."
"Can ginger, garlic, and chilies be carried in hand carry?","Checked luggage and hand carry are permitted on the aircraft only after undergoing security screening at the airport. However, items that emit strong smells or have pungent odors are prohibited in hand carry and must be carried in checked baggage."
Am I allowed to carry a power bank on a flight?,"You are allowed to carry a power bank only in your hand carry baggage. On board, it must be taken out from the bag and kept either in the seat pocket or held in the hands throughout the flight. It must strictly be turned OFF before boarding."
Is a power bank allowed in check-in baggage?,"No, power banks are strictly not allowed in check-in baggage."
Why aren’t power banks allowed in check-in baggage?,Power Banks are not allowed in check-in baggage because they are highly inflammable with the potential to cause further risk in case of fire emergencies.
Can I use a power bank during the flight?,"No, passengers aren’t allowed to use the power bank during the flight."
Cargo,"CARGO
We provide cargo services to various destinations. Check for any queries."
Where can I get information regarding Buddha Air Cargo?,You can get information about Buddha Air's cargo here: https://www.buddhaair.com/detail/cargo
How much cargo is allowed?,The amount of cargo allowed differs according to sector. You can get detailed information here:https://www.buddhaair.com/detail/cargo
What items are considered as DGI for cargo?,"We are not a dangerous good items (DGI) carrier. These goods are strictly prohibited on all our flights:
Explosives (fireworks, flares, grenades, etc.)
Gases (propane, butane, etc.)
Flammable liquids (gasoline, methanol) Petrol, etc)
Flammable solids (magnesium, firelighters, etc.)
Oxidizing substances (bleach, etc.)
Toxic and infectious substances (rat poison, infected blood, etc.)
Radioactive material (medicinal or commercial isotopes)
Corrosives (Mercury, vehicle batteries)
E-cigar
Kapoor
Lithium Batteries
Miscellaneous Dangerous Goods (vehicle parts that may contain fuel, wet batteries, etc.)
For more informations: https://www.buddhaair.com/about-us/catalogue/cargo"
Where can I receive my cargo from?,You can receive your cargo from the respective airport.
Where do I go to send cargo?,"You can send your cargo from the respective airport or cargo sales office. Our cargo office is located in Sinamangal, Kathmandu. You can contact at 01 4477321 for more details. If the cargo needs to be sent from outside of Kathmandu, then please contact our outstation sales counter."
Can I book cargo from the airport?,"Yes, you can book cargo flights from any of Buddha Air's counter."
Can I send documents as cargo?,"Yes, you can. For more information on the documents we cargo, please call 01 4477321."
Does Buddha Air provide cargo facility?,"Yes, we provide cargo facility in all our domestic sectors including international sector Varanasi."
What types of cargo is accepted on Buddha Air flights?,"We accept any general cargo, courier, perishable, live animals, life-saving medicines, newspaper, magazine, valuable goods, letters, etc. For more information: https://www.buddhaair.com/about-us/catalogue/cargo"
What information do you require for cargo?,"You will need to clearly state the following:
Name of the shipper (the person who will be sending the cargo)
Name of consignee (the person who will be receiving the cargo)
Origin and Arrival destination
A valid working contact number of shipper
A valid working contact number of consignee
Address of consignee"
What is cargo rate?,Get the latest and updated cargo rates here: https://www.buddhaair.com/detail/cargo
How should my cargo be packed? Is there any strict packing guideline I can follow?,"Before sending your consignment, it has to be prepackaged and all the necessary supporting documents that may be required  to ensure their safety during carriage."
"My cargo was delivered, but it was damaged? What do I do?",Please inform our representative at the cargo counter regarding the damaged cargo.
What should I do if I need to cancel my cargo?,To cancel the cargo please call 01-4477321 to learn more about cancelation process.
The recipient's details (name or address) is incorrect. How can I correct it?,Please call 01 4477321 for more information on this.
What documents or information do you need when I ship my cargo?,"Documents may vary depending upon the type of cargo you will be sending via Buddha Air. However, you will need to clearly state the following:
Name of the shipper (the person who will be sending the cargo)
Name of consignee (the person who will be receiving the cargo)
Origin and Arrival destination
A valid working contact number of shipper
A valid working contact number of consignee
Address of consignee"
Can I cargo live animals?,"Yes, you can. Please note that rates apply for cargo of live animals. You can get the updated rates for live animals here: https://www.buddhaair.com/detail/cargo"
Does Buddha Air carry cargo on its flights?,"Yes, we provide cargo on our domestic routes."
Who is the consigner / consignor (shipper)?,The consigner/consignor (shipper) is the person who will send the cargo to the receiver (consignee). The name and working contact number of the shipper must clearly be shown on the consignment note.
Who is a consignee?,The consignee is the receiver of the cargo/consignment. The name and working contact number of the consignee must clearly be shown on the consignment note.
How is cargo accepted by Buddha Air?,We will accept cargo that is brought to the sales offices and outstations of Buddha Air.
Do I have to purchase an flight ticket for cargo services?,"No, you do not need to purchase ticket to send cargo. Our cargo is an additional service that we provide for our customers."
Can I transport my pet as cargo?,"For information on this, please refer here: https://www.buddhaair.com/detail/traveling-with-pets"
